<?xml version="1.0" encoding="UTF-8"?>
<form1 xmlns:xsi="http://www.w3.org/2001/XMLSchema-instance" xsi:noNamespaceSchemaLocation="GM_renewal_schema.xsd">
  <Form>
    <formType>RENEWAL</formType>
    <deviceCategory>GM</deviceCategory>
    <VersionNumber>202311</VersionNumber>
    <section1>
      <applicantLastname>applicantLastname</applicantLastname>
      <applicantFirstname>applicantFirstname</applicantFirstname>
      <applicantMiddleinitial>applicantMiddleinitial</applicantMiddleinitial>
      <healthNo>healthNo</healthNo>
      <versionNo>versionNo</versionNo>
      <DateOfBirth>DateOfBirth</DateOfBirth>
      <sex>sex</sex>
    </section1>
    <section2>
      <question1>question1</question1>
      <question2>question2</question2>
      <question3>question3</question3>
      <certification>certification</certification>
      <signedBy>signedBy</signedBy>
      <signature>signature</signature>
      <signDate>signDate</signDate>
    </section2>
    <section3>
      <contact>
        <relationship>relationship</relationship>
        <agentLastname>agentLastname</agentLastname>
        <agentFirstname>agentFirstname</agentFirstname>
        <agentMiddleinitial>agentMiddleinitial</agentMiddleinitial>
        <agentUnitNo>agentUnitNo</agentUnitNo>
        <agentStreetNo>agentStreetNo</agentStreetNo>
        <agentStreetName>agentStreetName</agentStreetName>
        <agentRRoute>agentRRoute</agentRRoute>
        <agentCity>agentCity</agentCity>
        <agentProvince>agentProvince</agentProvince>
        <agentPostalCode>agentPostalCode</agentPostalCode>
        <agentHomePhone>agentHomePhone</agentHomePhone>
        <agentBusPhone>agentBusPhone</agentBusPhone>
        <agentPhoneExtension>agentPhoneExtension</agentPhoneExtension>
      </contact>
    </section3>
    <section4>
      <vendor>
        <vendorBusName>vendorBusName</vendorBusName>
        <adpVendorRegNo>adpVendorRegNo</adpVendorRegNo>
        <vendorLastname>vendorLastname</vendorLastname>
        <vendorFirstname>vendorFirstname</vendorFirstname>
        <vendorPositionTitle>vendorPositionTitle</vendorPositionTitle>
        <vendorBusPhone>vendorBusPhone</vendorBusPhone>
        <vendorPhoneExtension>vendorPhoneExtension</vendorPhoneExtension>
        <vendorUnitNo>vendorUnitNo</vendorUnitNo>
        <vendorStreetNo>vendorStreetNo</vendorStreetNo>
        <vendorStreetName>vendorStreetName</vendorStreetName>
        <vendorCity>vendorCity</vendorCity>
        <vendorProvince>vendorProvince</vendorProvince>
        <vendorPostalCode>vendorPostalCode</vendorPostalCode>
        <vendorSignature>vendorSignature</vendorSignature>
        <vendorSignDate>vendorSignDate</vendorSignDate>
      </vendor>
    </section4>
  </Form>
</form1>
